"i walked in with a lot of ""hair baggage"" - heavy processing, regrowth, etc. i needed to get damaged hair cut off while retaining as much length as possible. stacey nailed it. she was easy to talk to and understood what i needed pretty quickly."
"if zero stars were an option. checked in on line, when we arrived i explained that my daughter needed a shampoo/blow dry. the girl that came up to the counter began to act strangely and rudely said she could do a shampoo and 'i can do a finger dry"".apparently they didn't have time to dry hair with a brush because they are having a hair cut sale and ""customers for haircuts might come in""i have never heard of a business that didn't want to take your money for services.my daughter spent almost 2 months in a burn hospital and is unable to wash and blow dry her own hair. this was the most ridiculous display of customer service, i have ever experienced. wouldn't recommend this place to my worst enemy.maybe they should display a huge sign on their door and on line...stating....""we are only able to do $7.99 haircuts right now even if no one else is in here...because they might come in at any moment!"
"this review should be negative stars! do not get your hair cut by the older hispanic lady with the glasses, she will butcher your hair!!! she messed up my kid so bad he had to buy a hat just to cover what she did to him  it was such an easy cut..smdh! this lady cut half of his head bald, honestly she should not be cutting hair! she should be fired!"
"crummy service.  seems like every time i come here they shorten the time they spend with you.  hurried cut, leaving hair all over your clothes, face, forehead.  don't even think about going back to work or anywhere after this cut except straight to a shower.  pathetic.and now let's talk about the actual haircut.  crappy to say the least.  shoddy job, crummy uneven cut by all stylists, not even a fraction of what a true barbershop could accomplish.  simply put don't go here unless you want pure garbage."
bad experience. i went there because i had a coupon but apparently they don't take electronic coupons. we live in an electronic world. would never go back
some new girl just gave me a crew cut. said my customer info said that was my cut. week before big business. trip.  i am not a vain person but this is ridiculous. never going here again.  told girl i get it cut every month of 6 weeks.  can't she tell i don't get a crew cut.  ignorant and inexperienced.
"crappy place, does not take expired coupons. doesn't state on window about there coupon policy. will not go there again"
"if i had known that i was going to get my hair chop-chopped  by edward scissorhands then i wouldn't have even entrusted my precious hair to them.  i realize, of course, that by going to great clips i wasn't going to be getting a grade-a  haircut but then again i wasn't going to great clips for anything but a trim.  a very minimal trim that should have been anything but difficult...instead i got a hair trim where way too much length was taken off and the cut itself looked too, top choppy.  my hair now looks as if i had taken a pair of kitchen scissors to my hair and just started cutting away.  when i went in i specifically asked for a teeny tiny trim so that my dead ends could be done away with and i also specified that i did not want any thinning or layering of my hair.  what did i get?  an inch and a half cut off of my hair and the most choppy layers imaginable.  the cost of the haircut was $14 and for females (who, sorry guys, need much more effort and acute attention put into our hair) you get what you pay for.  if i'd known they'd be so incompetent at simply trimming the ends i'd never have step foot in here. i'd never have come for an actual haircut and i guarantee that i never will.  however, for males, great clips is a good option and in fact my fiancé comes here and gets his hair cut regularly and it always turns out well."
"been coming here for years and love this place. so much so that even after i moved to the city i still find myself coming back to them. go see ross, wait for him if he's busy with another customer. he is absolutely worth the wait. i promise you that you will not be disappointed."
"stopped in today for a haircut. i have been to great clips before so they have a write up on how i like my hair cut. things seemed to be going smoothly when the lady cut off a large chunk of my hair. it was late and dark, so i paid for my haircut, tipped her and left. i get home to better light...the lines around my ears look like an impressionist painting. it is basically a buzz cut because she left so little of my hair long on the top of my head. i will never return to this location. waist of time and money. guess i have to wait for my hair to grow back."
went for a quick haircut during lunch and got a great one from ross.  he was attentive to exactly the haircut i wanted.  made sure the top was the length i wanted before he actually cut.  i would definitely come back here for another cut from him.  in and out in less than 30 minutes too!
"horrible service. checked in online, arrived on time, and was asked at the counter if i checked in online to which i confirmed. then sat there and was repeatedly skipped for 20 minutes beyond my time until had to ask why i was being skipped for people walking in without appointments and i was blamed for not checking in at the desk when the lady obviously failed to mark it after asking me initially. what is the point of an online app if you ignore those that use it? and where is the customer service to ask why 1 guy has been sitting there for 30 minutes while the person walking in now gets helped."
"great place for an inexpensive but decent hair cut. bill (owner) is very friendly, and makes sure his service standards are kept high whether he is there or not. a great plus when the place is open long hours for your convenience. most stylists do decent with my frizzy, thinning hair. as with most things, some do better than others.a great option is to sign up online to save your place and cut wait times! you can't pick a stylist, but can save 15 minutes by getting in line before you leave the house!also check for coupons. great deals in the mail! tip well if you like the service, too."
"went in to have about 2 inches cut off the bottom of my straight long hair. i asked her for a perfectly straight even bottom line cut. also stated that i absolutely did not want the front to be any shorter then the back & that i did not want a curved look. started with a shampoo which was optional by the way, and a conditioning treatment to detangle. the shampoo job was ok but i didn't think she rinsed much of the conditioner out. the stylist didn't organize the hair very well as she was cutting it, and literally she finished in slightly over 5 minutes. when she was finished she showed me the results whilemy hair was still wet. well , you can't tell anything when the hair is still wet. i guess at that point i was done and expected to leave. so i asked if she was able to blow dry it and style it which is pretty easy with straight hair that's all one length. she used the blow dryer and tossed my hair around with her fingers a little bit and then asked if that was ok. now it was worse and even harder to tell if she cut it straight. my head was still very wet so i asked her to finish drying it. i think she was bothered by this because now a couple people had come in the front door and were waiting. she never used a brush to assist in the drying process. when she said she was done the 2nd time, i still had wet sections throughout my hair and it wasn't even brushed or combed to lay flat so there was no way to tell if this was a good haircut. once i got home i rewashed my hair because it felt like there was still a sticky layer of conditioner left in it from the stylist, and i wanted to check and see if my hair was cut straight. after i dried and styled and smoothed my hair as i usually do i saw that the haircut was a disappointment and a fail ... it is not a continuous straight line, the front is shorter then the back and there are areas that are jagged throughout. so, skip this location if you're looking for a nice simple straight line . mine turned out crooked and the overall experience was not great . the conversation she initiated was a downer too. all she talked about was cancer... i should probably go back and ask someone else if they'd be willing to correct my cut, but i'm reluctant thinking the place is really centered on the ""quick get em in and get em out"" business mode, not quality. i'm not sure why i even gave it a 2 star rating . it did however appear to be clean."
friendly and clean in and out 30 min no appointment just walked in. they did a great job. i've used them every time i'm at the all state arena doing a show. i've used great clips all over the u.s. never been dissatisfied or disappointed!!
"so i just witnessed one of the most rude customers in my life at this great clips. i was patiently waiting for my haircut when this lady starts yelling at the one of the employees about how she's getting screwed in her prepaid haircuts. i don't know the background and whole story why she was so upset. it doesn't matter. there's absolutely no reason to yell across the store when the person you're speaking with is two feet away, especially when your children are with you. what a wonderful example to set for you kids. throughout it all, the employee was professional, helpful and kept her calm. at one point she did end up tearing up, excused herself and walked to the back room to compose herself. the customer then complained and yelled about how she just left her and didn't resolve her problem. ridiculous and embarrassing. she should be ashamed of herself, but she won't. she never will. she's ignorant to the world and will always think she's right no matter what and will teach those lessons to her kids. let's continue the cycle. as for the employee? thank you so much. you are an amazing person to be able to put up with people like that. i couldn't have done it."
"i respectfully disagree with a previous comment, this place was over priced and not a good haircut.   i actually went to another barber shop after leaving this place.   this was easier than to keep on trying to explain what was wrong."
"been here twice. i had different styists each time but i don't mind not having the same stylist every time i get a hair cut.  service is always super friendly and courteous. the owner/manager (guy who greets customers) is always friendly & accomodating. super clean place. hair on the floor are swept/cleaned right away. called ahead to set up appointment but owner said no appointment necessary for a hair cut. service is straight-forward, quick, no muss/no fuss, and affordable (i believe approx. $15 per hair cut).  keep up the great work!"
"ross cut off my long hair into a short style on my lunch! when i got back to the office everyone complimented me on the beautiful cut. 5 stars for ross talented, professional, personable ."
"if i could put no stars in i would. i went in here today with my mom. both of us have been in before and had good and bad experiences. after today though, my entire family will never return. i was there a month ago and the man who cut my hair did not really do what i asked. when i got home, i wasn't too happy but i decided to wait and see if it would grow on me. it didn't. and everyone i talked to about it said my hair looked uneven and everything i did didn't help. i went in today and started to explain how unhappy i was and the stylist began arguing with me about it. she told me i was wrong and that it wasn't uneven. i told her i had even consulted with another stylist before going in today and that the stylist said it was uneven and needed to be fixed. she continued to say i was wrong and i decided to get up and leave without a haircut. i'm not a big believer in ""the customer is always right"" but i do know that i am the one who has to style my hair everyday for work and no matter what i do it looked horrible. my teenage students could even tell that it was a bad cut. my mom received a haircut that was way shorter than she asked for and it was uneven as well. we will not ever return to this salon. we are currently at another place altogether and getting our hair fixed; we will go here from now on."
they cut extensions!! hair cuts for purchased hair (lol) is getting increasingly difficult to find. stephanie cut my hair and did an amazing job. very happy.
my hair is pretty simple to do. and mike took all of 5 minutes to do it. the top seems ok but the back is asymmetrical and with a weird invected half circle instead of a straight line. maybe at 9am they are still a little groggy.. dunno. i expected a little more attention to detail. disappointing.
"mike is my absolute favorite stylist in chicago. i've gone to other places to get my hair cut and even sat in other stylists' chairs at this great clips location, but nobody listens and cuts like mike.i'm growing out my hair right now so i'm a relatively ""easy"" trim, but it makes such a difference when i can walk out the door still feeling like my hair is long. mike is also great at evening up my bangs and layers each time so i don't look too scraggly.i've loved coming here for the past three years and will continue to stop in no matter what neighborhood i move to!"
i came here right when they opened at 9 am to get about 4 inches cut off my obnoxiously long hair. they offer a special where you can get your haircut for 10 bucks between 9 am and noon on weekdays. stephanie was my stylist and she was amazing! very kind and gentle with my hair. the salon was clean and the service was amazing.
"i always come here to get my hair cut or trimmed because of it's convenience and also because it offers a great student discount. i've never been one to pay $20+ for a trim so great clips is the perfect option. i never check-in online (their version of an appointment) but there never is much of a wait which is nice. the hair cut itself, since it is a trim usually lasts pretty short so it's quick and easy! however, last time i was here the hair stylist was so rough with my head by the end i was sure he had pulled out more hairs than cut. i understand my hair may have been tangled but he was really going at it with the comb to get the knots out and i feel like it could have been done a lot gentler. in general he was rough during the cut as well and while the final look ended up fine it wasn't the most enjoyable hair cut i've had.the venue is nice and clean but this experience really caught me off guard and i will have to check who is working next time before i walk in so as not to experience the same thing."
"walked in this morning and was seated immediately! just wanted to leave a review thanking stephanie, you did a great job with my fade and it was really nice chatting with you about school and chicago!hope to be back soon if i'm in the area. good luck with your upcoming internship too! thank you stephanie!"
"mike, the manager here, is the only person that i go to for a haircut.  there are 20 other places to get a haircut that's closer to me, but mike is the absolute best so i go here.  the overall vibe here is very lively and very friendly"
"we recently moved to california but i needed to leave a review for the wonderful, fabulous mike at great clips. he cut my family's hair for the 3+ years we lived off clark street in lincoln park. he is a wonderful person and a very talented stylist! we miss you mike!"
"they dont know how to cut hair, i literally asked for a trim. how hard can that be? its uneven its a wreck. they are not professionals."
"i have been to this salon before and generally get a decent cut, but tonight i am unhappy because i explained that i was growing out my hair on top and i just wanted the sides and back cut with as little as possible cut from the top. it looked fine when i left the salon because my hair was still wet. when i arrived home and it was dry, it was much shorter than i wanted. i am very disappointed since i have been growing out my hair for months. i think i will start looking for a new place to get my hair cut where they actually listen to you."
"stephanie is easily the best hair stylist i ever had the pleasure to go to.she likes her work, does it to perfection and has an awesome sense of humor too.i, personally, have a kinda weird style statement and i mostly don't listen to stylists, etc. but stephanie definitely understands what i look for and gives me perfect suggestions, which i listen."
"this great clips is alright. the staff is friendly but the few times that i've visited, they made mistakes. the first girl that cut my hair was excellent, so i came back. the next one gave me a slightly uneven hair cut but it wasn't anything i couldn't touch up myself. the most recent experience was embarrassing because the stylist said my previous haircut didn't look great, which i agreed with but after she gave me a trim and tried to fix the uneven sections, she said she still didn't like it but there was nothing else she could do. i let her know that i didn't mind losing length as long as the mistakes were corrected. my hair at the time was mostly all one length so i thought it would be a fairly simple correction.i decided to pay more at another salon to receive more consistent cuts. i hope to return in the future because it's so close to home and reasonable in price but unfortunately it's not an option at this point in time."
"this shop just relocated but i went to their previous location on diversey several times and i've always come out with a good haircut at a great price. this may not be the place if you have some complicated haircut that you're anal about but for a basic haircut they get the job done.  they usually have three or more people working so there usually isn't much of a wait.  if you can get in weekdays between 9:00 a.m. and noon, a haircut is only $9.99. otherwise, it's $14."
alex is a real star:) she is amazing! i went and had an up-due for a very important event with her and for a fraction of the salon price she absolutely knocked my socks off with her creation. please ask for alex and you will have blow out of a lifetime... love love love my experience!
"i love this salon! i have a boyish pixie cut that i am very particular about, and a fear of haircuts has had me cutting it myself for years. this is the only place i've been to with stylists who seem to really listen to what i want and give such satisfactory results! i've been seeing stephanie here for months (by coincidence! she always ends up the one cutting my hair) and she's incredibly sweet and funny, and so easy to talk to! she always does a great job -- i know i'm going to have a great day every time i see her! she's really respectful of me trimming my bangs and sides in between haircuts, too, which i appreciate! she cuts off the extra bulk, but leaves my style exactly the way it is. i am so grateful for this great clips!"
"definitely a great deal. i was paying double + tip for a great haircut nearby so decided to try and cutback on expenses and check out great clips. the shop is clean, the price is great (i had a coupon but weekdays 9-12 are $9.99 and usual price is $14) and my barber joey helped alleviate some of the usual awkwardness of a haircut by adding some decent conversation!"
"great haircut, great service, and what a clean shop.  mike gave me one of the best haircuts i've had in a long time!"
"great new place- they just moved from their old location on clark/diversey.  this new place is very clean, nice, and the service was great.  i was in and out in under 15 minutes with a great haircut."
"checked in online way before noon, braved the - 25 windchills to get there, ended up arriving due to traffic and weather at 12:02, and they wouldn't honor the early bird special that ended at 12. the former store on diversey would have honored it as long as i was checked in, and in fact did so in the past. not the way to treat a regular customer, so they lost this one."
"i went in for a simple 1inch trim of my hair and ended up loosing about 4inches. i had long hair with a slight angle, i don't think the girl knew what that meant because before i knew it i was missing half of my hair in the front. it was a waste of money and now i'll have to wait months for my hair to grow back out."
never too busy when i come in. they always have great staff and a cheery demeanor. the cuts i get are always what i want and they have no problem fixing up anything i want touched up. consistently great men's cuts!edit: after waiting 20 minutes a couple who had called in were bumped in front of me. i was not told they might have someone in front of me and they didn't let me know what was going on when they took them instead of me until i asked.
"i wish i can give this salon a zero stars but i can't. walked into the great clips on elston in chicago; i asked for a haircut. first of all they stylist both were so rude. one literally screamed across the salon to get the attention of the other person who would eventually cut my hair. so few things about this stylist who serviced me, 1. she had dirty clothes on and just messy ( the insoles on her shoes were out and flapping as she walked )2. she took literally 5 mins to cut my hair. i asked her for a bob i even showed her pictures. she split my hair in 3 and cut all the same length. i've gotten plenty of bob haircuts and no one has taken that approach would not be back to any great clips. even that 15 $ i paid was too much."
"the owner of this location is garbage, and so is the staff. hence why it shut down quickly after new ownership. it's sad how they tarnish the name of a big company simply because the owner of this specific location puts zero quality into it's establishment. zero customer service whatsoever and terrible haircuts all around."
i receive by far the worst hair cut i've every had and will never go back to a great clips ever again. this women should not be allow to cut anyone else's hair. beware!!!
wow these people are terrible. they closed to early when online it says 6pm. and when you call them they literally hang up on you. i understand it's sunday you want to go home and rest but do your job right. especially if it says open until 6pm it's 4:28. stop hanging up on your customers.
5:34 on sunday store closes at 6:00 but the guy won't cut my sons hair . doors are locked and he is cleaning . thanks great clips i
"this place is busy,but i understand why.. lydia is very nice. she was able to cut my daughter's hair with no issues. very friendly staff. if you want to get in on time, use their app. you can schedule your cut. nice touch..."
"sometimes this place gets really busy and the wait can be 45 minutes.  but the workers are friendly, and the interior is clean.  they do give out these coupons for savings off of cuts and since it is next to me i been going here.  shares the lot where i work so it has huge parking, and if you do have to wait, there is a subway and a starbucks walking distance."
being a huge fan of great clips i went by and picked up a haircut. this seems to be a new location. the lady who cut my hair did a great job and i have no complaints. the store was clean and service was fine. i'll probably go back here again since it's kind of close to where i live. nothing else really to report. just another great clips.../shrug
lydia the manager was very friendly & helpful after i had a bad incident there. since then i only go there to get my haircut now & i always make sure she is the one to do it. i am quite satisfied.
"went here for a haircut two weeks ago, it was my second time. i say, wasn't too crowded. was called and said that i wanted a shampoo and wash. so, i have very thick and wavy hair. i had rose who was nice.  went out to dinner with my friend tonight and she informed me that my hair is completely lopsided and uneven.  i was mortified.  she took a pic for me to see and since i wasn't offered a blow dry with the haircut i guess that's why it wasn't noticed. i wish i never wasted my time or money here, and i wish i went to gallery of hair instead.  more money,  but at least i would have been happy the first time.  now i have to go get it redone and even shorter than what i wanted.  on my job interview tomorrow i have to wear my hair down, but not with this embarrassing haircut, that looks like i did it myself."
"friendly staff, clean atmosphere, quick service and extra coupons to save you a few bucks!!! i get my hair cut here regularly and i use the handy app to check in... in and out in approximately 20 minutes with a great haircut!"
"i never actually got my haircut here...i was in the shopping center and thought i would get a haircut. when i walked in a women from behind the counter barked out ""phone number?""  i was the only person there so i knew she was talking to me. why does an off-price/chain hair cut place that doesn't take appointments need my phone number? what happened to the canned chain store greeting? ""welcome to our mega company""i quickly realized why i was the only person there and left."
