"my family and i have been coming to this place for the past 7 years. they are extremely consistent and always have a great attitude. they always welcome you with a resounding, ""welcome to greatclips!!"". we plan on using their services for many years to come."
"you like to gamble? are you into fits of anxiety? this place is like putting your quarter into the gumball machine and hoping for the red piece... sometimes you get it... some times you get the yellow one. isn't it obvious? every time you come here, there's different stylists working? forest gump could have written this review... ""you never know what you're gonna get...""  i only go here when i'm feeling suicidal... anyone up for a little ""haircut roulette?"""
"no wait great service very fast and efficient, did my brothers hair cut just how he wanted"
"the place started to go downhill. rude manager,  no longer offering discounts to veterans at this location and my last two haircuts ended with cuts in my head. alon location nearby is way better"
wow i cant believe the damage this place did to my pet boyfriend. he dropped in at about 10 am-11am for a haircut to get ready for new years celebrations and he walked out beat up and looking like he has some kind of rash or allergic reaction. the lady that cut his hair used dull clippers. it felt like he was being shaved with a disposable razor. it even broke skin in some places. please see pictures and avoid! 1 star for not messing up the actual haircut.
i had a great experience here at this great clips. the two ladies were really nice and the blonde lady did a good job on what i wanted. she looked at the picture twice to make sure and it came out beautifully. unlike the last time i went somewhere else i showed the same picture and she didn't do what i wanted.
"came here with my boyfriend to get his hair cut. he wanted a basic clean up and fade. nothing too drastic or difficult. the stylist on the (i cannot remember her name but she is above average height) was rude from the get go. when she finished his hair he had long pieces sticking up on the top on both sides, uneven shave on the bottom and an almost bald spot in the back. we went back the next day to ask if she could could fix it (maybe she didn't see it because of the lighting or something) and she said no that's just how his hair is because of a ""cowlick"" and ignored the other two problems. that's a common excuse from stylists who haven't had enough training or just haven't perfected how to do a fade. i asked as politely as i could, which is hard because situations like these are already super awkward, if someone else could try to fix it and she was obviously so offended. i can't pay for a service when i know that he doesn't have a cowlick and he's had his hair cut the same style perfectly at several other places. a polite gentleman fixed it for us while the other stylist made faces, shook her head, and made remarks under her breath. i thanked both of them again before we left but she wouldn't look up from her other client and acknowledge me... we tipped both of them. i also want to add that we have run into her outside of the salon and she made the ugliest faces and once again made remarks under her breath like we are in highschool. really? we tried to be as polite as possible. it's not my fault you didn't know how to do it and you should learn how to handle critism if you're going to do a job like that. it felt like she's expecting judgement and rudeness from everyone so she beats you to it and treats you poorly. i don't recommend this location only because of her. everyone else there is polite and professional."
"we'll never go back!!!  i ask for something to be done different, next thing i know my 4 year old says ouch.  she was being too rough if you don't like your job quit, don't take it out on my kid wow!!!"
"place is just ok, they don't actually work as per customer satisfaction, but anyways it was not really bad."
"we used to come for a decent haircut at a decent price. we now come here more for the convenience of the location. the stylist today kept asking for assistance from the other employees. it felt almost as if i was getting a hair cut at a beauty college rather than at a place of business with licensed stylists. i wasn't happy with the outcome, but i didn't want this person to cut any more cause i was worried that it'd come out worse. this isn't the first time. also, a number of the stylist smelled like cigarettes. not a good smell when your hand is in my face cutting my hair. sorry to say, i feel that the quality of work done at this location has really gone done."
"worst haircut of my life. ""stylist"" was harsh, music was loud and inappropriate for family setting. no receipt given. felt unwelcome, will never go back"
"very few good stylists at this location. i have been going for years and cannot recommend any by name except for xtina so don't have high hopes for quality work here. good haircut happens about 1/5 visits and i have left before because of stylists that i know don't communicate well and with less than a professional attitude. lottery every time but the damn location is so confident...an checking in ""online"" or with the app is not much better....you still sit in like with the others that check in and sometimes even walk ins depending on your time."
"i think the experience at any salon depends on the hair stylist. if you found someone that did a good job, keep using that person. just few tips:1) come here around 8 pm on week day, there is usually no line. i think out of the 10 times i'm here, the longest wait was 10 mins. 8/10 times, i check in and i go straight to the chair. 2) weekends or long weekends, this place is packed."
"went to get my hair curled and had a picture to show the stylist what i wanted. absolutely horrible job, put too much product in and made my hair greasy and she comb the curls out which made it frizz. i had to leave and was very disappointed in the job, i shouldn't have paid. i was on a time limit, which the stylist knew. i left to go wash my hair and style it myself, which came out better than the job i received. never going back again. i'll stick to the blow dry bars, better pricing and they do a way better job!"
"they do a good job here, i am pretty simple with my hair, just a shampoo and cut at the ends. i enjoy the shampoo, they do a little massage to your scalp that feels nice. sometimes they try to push their products for sale, which i don't like."
"i don't like hair cutters who nick the skin around the scalp when my kids get a haircut. probably will not be returning for a long, long, long time."
"i agree with most of the other reviewers, this place is a lottery. $13 for adult cut, not too bad a price, and they run specials every once in awhile. i've been to this location twice: the first time there was a young girl that went by the name sami (maybe samy) and she was amazing. i wanted a drastic change to my long curly hair, and she worked meticulously on it; gave me layers and cut it shorter than i've ever had it. i absolutely loved it. i came back about 4.5 months later to get it trimmed, and i was told she no longer works there, so i just let another stylist cut it. she did fine, but she was against cutting as short as sami did. so i know i'll have to go back soon to maintain the length. i really wish i could find out if this hairstylist still works in san antonio!!!in conclusion, if you just want a quick, simple hair cut, this is the place to go.also, both times i went on a week day, once at 12, and the other at 1, and there wasn't a line."
"i got to say impressed with work and customer service from jelenna, she cut my daughters hair and did an amazing job!!!"
"so, many great businesses i've left reviews for have thanked me or offered to fix their error.  not one attempt from this franchise. i'm 3 weeks since my bad cut and hair is growing towards my ears and i'm starting to think about getting another cut..... but my bangs are still to short and pissing me off, so i'll wait a bit longer to get my next cut."
"i've gone there now 4-5 times, close to home, different stylist every time, and results are the same love it"
"i went here for years with my son and stopped going because i started to get a subpar haircut/experience. i'll admit, jennifer is awesome, but always busy, because she does a great job in which others always request her. but last week i needed to get a haircut on a saturday and decided to give them another shot since it was the weekend and i was desperate.  once again another subpar haircut and  subpar experience. i hate feeling like cattle and being rushed out in world record time. i'll be going elsewhere instead."
great service and availability of highly qualified hair cutting stylists.i appreciate the attitude and quality.online booking app/web is a great option
i usually go to get my hair trimmed and never had any issues so i took my husband to get his hair cut since we were both running errands and we can get what we need done together. he was hesitant he wasn't confident that the stylist would know how to cut i said i've never had an issue and there was lots of men getting their hair cut today. i was helped first and finished first. then waiting for him i saw his face and his horrible haircut. i was in shock how the hair stylist thought this was a good job to still want to charge him and we were so embarrassed to even dispute it while everyone was in close range. so i felt so horrible i paid... i even tipped again i was too embarrassed to go off on this stylist. i would never come back or have him come back. we had to go to another place where an experienced barber can fix his hair he only charges 14. if you want a jagged choppy haircut this is the place for you.
"if you go here, do not let karina cut your hair. she sucks!!! my husband & kids come here a lot & most of the time, the cut comes out okay because we give them simple instruction: 0.5 around & 4 at the top. i don't know how you can mess that up, but karina did! my son is taking his graduation pic this week looking almost bald. we'll still go back here, but we'll never have karina cut my boys' hair again!"
great place to get a hair cut. jennifer does great work and listens to the styles you'd like. this is the one out in eastlake.
i came to great clips and they have amazing service i was really happy with my hair cut it was so beautiful. great clips made my day!!
"great place for haircut for me easy to use the app and get a quick appointmentalways fast and easy for mei see some of the women had reviews and issue with their hair, so not sure about that.i would recommend for men as it is in the shopping area and i can go to target and lowes will i amin the shopping area."
"very uneven hair cut for myself and my wife. will not be going back again, i wasn't happy the first time either. cheap hair cut but you get what you pay for."
last minute find before heading back to guam. was welcomed by sally. wonderful personality and made the hair cut entertaining. thanks. hair cut on point.
"if you're looking for a haircut without an appointment,... seek another place. this establishment only focuses on online appointments. wanted to try this place since it has a lot of good reviews but,... completely had a horrible experience. waited for more than an hour to get a haircut!!!!!!!!!!!!!!!!!!!!!!!!! wtf! to make matter worst,.. they kept a screen with names who's next but does not follow it. was second and yet was passed (girl picked the 5th person without online appointment) fuck this place."
"i take my 7 year old son here for his haircuts, definitely recommend jennifer! she's super nice, always double checks with me before and during the cut. his hair looks perfect every time."
"been going to this place for about 3 years. sally has been cutting my hair majority of the time when i came in. i get along with her, she's nice, and caring."
"this place has such a great vibe. the women who cut the hair are extremely nice, except for one, but other than that, great service! i recommend sally! she's probably the best out of them all, so ask for her!"
katrina did an amazing job on my sons first haircut. she was patient yet quick. my 1 year old was not scared at all! thanks for the great cut!!!
"definitely a decent place to get a haircut if you are in the eastlake area.  i have come several times and have had good experiences so far.  the prices are reasonable, the stylists are helpful and the place is clean.  i highly recommend checking in online during peak hours otherwise you will be waiting for awhile."
"the worst haircut in 12 yrs. i asked the stylist to take 1 1/2"" off my girls long hair w/a tiny bit of layers. clean up what she has. she showed me her definition of 1 1/2"". i agreed. during the cut, 3 stylists went to my daughter & measured her hair where cuts were made. one or two made addt'l cuts. in between, the original stylist made more cuts. after the final ""helper"" left, i asked her to tell me honestly how much had been cut, while more is being cut from my daughters hair. she said, ""1 1/2 inches."" i said my anxiety was due to the 3 ""helpers"". she says, ""oh we just checked her cuts. don't worry. it's a great cut."" i will not be back. (trying to post a pic.)"
"i've always had good experiences here. employee turnover means you can have a regular hair stylist but within 6 months they are gone. but everyone here is good...they keep notes in the computer of your hair styling needs. clipper length, style on top, etc... parking in this lot can be kind of crazy especially at busy periods."
"i've been going to great clips for quite awhile. i started off at the balboa store, and have been getting my cut from frankie. my wife and mother also see frankie. all three of us are extremely happy with the effort that she always gives. frankie pays attention to detail and remembers how all three of us like our cuts. she always gives suggestions, and we've never once had a complaint since frankie became our stylist. so, if you are looking for not only a great haircut, but a stylist that will make your time in her chair, fun, then go to the pacific beach location. if you have a cell phone (seriously, who doesn't?) get the great clips app, and check in online, and have a much shorter wait."
"i am also part of frankie's ""fans"". frankie relocated here to this location. this great clips location does not offer the discount card for multiple haircuts. that is why i am giving a 4 for the salon but believe me a 5 for frankie."
first time coming here.  i brought my five year old son.  i love the location as it's close to home and conveniently located near a frozen yogurt place for a nice treat afterwards.michelle was his hair stylist and was so good with him.  right before us she cut the hair of an 18 month old baby.i showed a pinterest picture of the hairstyle i was going for and she did amazing.  i have had already a few moms ask where did he get his hair cut.so i'm here to say michelle is awesome with kids and an expert stylist.cost: $15tip: $5cheaper than little locks in la jolla.they could make it a bit more kid friendly.  we appreciated the lego blocks and lollipop  very much!!
i hate to complain about a $17 haircut but as soon as we got to the car and i saw the uneven lines and long patches everywhere i went straight to cvs to purchase clippers. i couldn't let him go to school in the morning like this. i wish i had taken more pics but it was pretty bad
told me i had to check in online. this place is only good if you don't mind average. they had an attitude and it seemed i was a bother as opposed to being a customer.
i came in today and there were two people getting a haircut. one person was in front of me and i was told a 10-15 min wait. 50 mins later one of the 2 hair stylists leaves and there is still one person in front of me. waisted my hour off for lunch to end up not getting a haircut. never coming back.
"deebeh is the best!  this great clips has deebeh! the other stylists are probably good, and they cut hair fast with a great value.  i have been going to this great clips for almost four years because i had a not-so-stellar haircut (by someone who has now left this location) and deebeh fixed it no questions asked, with a polite apology and a smile!since then, deebeh has cut my hair approximately 50 times, and each time she is pleasent, friendly, professional, and does a fantastic job.  she is great!so, while i keep going to this great clips because they are cheap, and get the job done, i definitely recommend deebeh because she is awesome, and does great work!"
shout out to veronica for giving me the best haircut of my life. i'm hard to please when it comes to getting my haircut but veronica nailed it the first time she ever cut it. i explained how i was unhappy with past haircuts and she asked me a bunch of questions and found out what i was looking for. she is a true professional and i'll definitely be coming back
"been coming here for 4+ years. never really have to wait, all the employees are friendly but don't talk your ear off. shelly is great!"
"irma is the best hairdresser on the planet. no question. she is incredibly professional, detailed oriented and one of the nicest people to deal with. i refuse to let anyone else cut my hair!"
"irma did an amazing job. i'm new to la jolla and was in search for a new stylist after 10 years. she's competent, caring, and detailed oriented. highly recommend irma!"
i have been going here for a year now. checked in online which said to arrive by 5pm i arrived 15 miutes before and was rudely told they are closed. i asked abiut my online checkin and she rudely stated again that they had a busy day and she was not cutting anymore hair today. she was right she will not be cutting my hair. i feel sorry for victoria who actually does a great job. that is the reason for the 2 stars. victoria 5 stars.
"they messed up my cowlick. worst haircut i've gotten in years, and i've been getting it cut the same way for ~5 years. won't be coming back"
unfortunately this location made their own policy for veterans day and chose not to honor the promotion as great clips is know for.  i reported them to great clips hq and they said the franchise owner is in the wrong!  chose another location for veterans!
"i took my daughter in for a bang trim, she was so obedient and sweet - did everything the woman said. i stayed on the sidelines and didn't interfere and was very unaware of the horrible haircut that was being done. her bangs were crooked and choppy and she absolutely hacked the sides of her hair leaving her with a ""mullet"" style haircut: super short bangs in the front, choppy hair at her ears and long straggly hair in the back. when she presented my daughter to me and said they were done i couldn't help but laughing out loud. instead of apologizing and offering to fix the things i was pointing out to her she justified her work!! absolutely unprofessional. she then charged me for my visit. i took her to the great clips in the utc and the women there fixed her hair cut for me. they were polite and apologetic and ""did their best"" to fix the hack job done in pacific beach. we will never go back to irma at the pb great clips."
"do not work for this franchisee. im currently going through the necessary legal hoops to ensure that they are exposed for unprofessionalism at levels that have exceeded civil and legal standards that i promise will not benefit u. i was treated (in my opinion) discrimination do to my living situation ,gender and sexual orientation. i was held accountable by policies that were never given to me. training that is only given if u ask other employees that can access all your pr info do to shared passwords. pay is allocated by clocking in and out but if your time clock is not to the owners liking she will gladly alter or change it. this will not be shared with you. if you dont keep record of your time you may find your hours are not accurate. this is my personal experiences that i hope will help yours not be as unfortunate. proceed with caution. supercuts is much better and will allow u to grow ur skills."
"terrible, terrible customer service!  used the online check in for my son (19 months).   we did some errands because the wait was 63 minutes.  i still waited an additional 30 minutes beyond this.  as it was about his turn,  we had to do a diaper change.   i told them i would be back in 2 min, which i was.   they proceeded to let someone else go in front of us.  i've been going there for almost a year but this will absolutely be our last time.   the hairdresser was super rude and inconsiderate towards me and my child."
"my experience at great clips was, as the name suggests, great. i checked in online, arrived at the shop and was seated immediately, the haircut was fast but with great attention to detail and my instructions (i brought pictures to show what i was looking for) and i left with my hair cut just the way i wanted it. and all this friendly and great service at a very affordable price (even for a student) !(the only downside was that i could not blow dry my hair over a round brush, which would have been charged extra.)"
i've been coming here for awhile now and never have to wait very long in order to get my haircut without an appointment. yesterday i went and had sam cut my hair for the first time. he was really nice and explained hair products to me and had a friendly discussion as well. he also took extra steps for a smoother blend and reccomended the best ways to get discounts on the product they offer.  i will be back soon!
first time i came here a year ago they butchered me. i am reasonable and i know things happen and at the time i just let it go. so a year has passed and i figured i would give it a second chance.  this time i left with a bloody nick behind me ear and a botched fade. when the girl cutting my hair started to cry about what she did she mentioned how hard things are for her and that they only pay her $9 an hour. i felt bad for her and left after tipping her $5 to cut me.  at $9 an hour i guess they dont care about having qualified styists. live and learn i guess. probably better and safer to find another place to go for a haircut..
"i have come here every week for the past year and and i have never been disappointed.  if you need a good fade and netflix recommendations, ask for sabrina."
"i walked in and got very nicely greeted. i waited  a short time, the only woman that was not smiling and looked like she just really hated her job lucia asked if i was ready. i was nervous cause of her attitude. i tried to lighten her mood to see if see would smile but it didn't work. she goes on to ask what i would like done? so i tell her i want a good amount cut in the back and layered in the front. she said she can't because i would have gaps and does not feel comfortable layering  my hair. instead of asking someone else to cut my hair she just asked someone elses opinion. that lady said whatever u feel comfortable with to lucia instead of asking to take over or if i am comfortable! this haircut wasn't brain surgery it was a simple basic woman's haircut. for them not to try to make me happy was unreal! i'm not sure how she even had a license to cut hair. this place i would not recommend ever! lucia was not friendly and the lack of haircut skills was unreal"
"i've been going to great clips about the last six months. as we are traveling the country in our rv it's nice that they can keep records of your visit with notes on how you like you hair to be cut. well, at least that's the way it's supposed to work......the fellow that was trying to check customers in shouldn't be doing this job. he's nice enough but his english language skills aren't the greatest. nor ar his typing skills. he never did get my info straight. one of the stylists tried but even she was unsuccessful. i'm not sure why. i've checked in from northern washington to portland, oregon to yuma city, california and never had an issue. strange. but, back to my hair stylist. i'd read a review where a mother complained about this gal being rough when she cut her daughter's hair. rough is an understatement! i've never had my hair jerked like that before. now for me it didn't hurt bad, but i can well imagine what that felt like to a five year old. i know it was the same gal although i don't recall her name. it was something like vima maybe. she sounded eastern european to me, not that that matters. but she needs to have a few lessons and tug a little easier on folks hair. i'm glad we're traveling. next time we're in the area i'll go to another great clips. just not this location."
worse place ever! she messed up my hair bad. waste of 20 dollars seriously. i was ready to cut most of my long hair off but she didnt listen! she did what she wanted with my hair. after i got home i looked at my hair and it looks like a 5 year old grabbed scissors and just chopped my hair. i think her name was sabrina. dont let sabrina get close to your hair!
"i recently visited this salon,  my experience was excellent. thank you girls for the great service and haircut for all my boys."
