"quality hair cut from friendly stylist.  not a high end salon and not priced like one.  in cut and out.  much better than the city ave location which is more culturally diverse.   need a quick cut, this is the place in drexel hill."
this is one branch of a big chain. the good news is-* clean and neat* competitive pricing* decent hours* in and out relatively quickly with no appointmentthe bad news is it can be difficult to get the same person each time.  if that's important to you another alternative may be your best choice.
"3 strikes and they're out.  there are plenty of other local places that are inexpensive that will give you a good cut.  i've tried them as well as others i know, and it's not worth having them ruin your hair then you have  to grow your hair out just to have another stylist fix your cut.  skip, skip skip!"
"i bring my son here for his haircuts and the stylists consistently do a great job. they maintain a computerized record of the clippers that were previously used, so there is no guesswork in trying to figure out what made the last haircut so great. the salon is tastefully decorated and i've never had to wait more than about 20 minutes - usually there is no wait at all early on a saturday morning or weekday evenings. you can also use the computer check in service to reduce your wait, but i haven't found the need. they have lolipops for the kids after a job well done. high"
i've been here quite  a few times and never had a bad experience.  everyone here is so pleasant and the store is clean as can be.   $13 haircut - yes please!  keep up the good work!
"what a rude, snotty staff....even laughing and saying they don't want to work on you to their other co-worker like you're not standing right there in front of them when we're donating for locks of love. it's not like anyone was even in the shop when we came in. wow...thanks katie. i don't know why we just didn't leave if it weren't to donate the hair. a tip shouldn't have even been given to the other co-worker who seemed to tolerate us until she was given the more than deserved tip for her attitude. what a disappointing visit to philly, especially when we were out to do a good deed."
"decent and cheap haircuts in the newtown square, you pay 12-14$ as a child or man, women pay more. my goto place around work"
"disgusting-don't ever go here. dirty is an understatement. stylists will upcharge you and sneak it on your receipt- that's what they did to me. nickel and dime, bait and switch to a loyal customer. after confronting their tactics they told me, ""we don't care if you ever come back, your dad, too. you can go to hair cuttery and look like an idiot when they screw up your hair."" this particular franchise does not care about their customers whatsoever. they'll likely be out of business very soon treating people in this manner. some small businesses truly deserve our money...this one does not. shameful. infinite negative stars.one year after i wrote this review and i contacted great clips corporate and received not even a return call, the owner ""joe g."" comments on all of the bad reviews with a copy/paste apology. it's laughable and demonstrates exactly the issue with great clips. i wouldn't return even if it was free haircuts for life. are you even real ""joe g""? and if you are the owner, a blanket copy/paste apology to negative reviews is a pitiful attempt at saving face on social media that will not counter the scarred reputation of this store or bring back past loyal customers. a year later...smh."
"i showed her a picture, i asked her to not take anything off the length. she totally ignored me and cut it so short i could cry. i'll never go back again!!!!"
i took my mom for her hair cut.  she is 86 most certainly a senior.  they have a senior cut for $12.00.  it cost her $35.00 because she wanted her hair dry before she left.  she did not get her hair washed either.  but we were told the $12 was a cut only.  who goes out of a hair salon with wet hair. really $24 to have your hair washed and dried is ridiculous and nobody would go into the cold with wet hair.  a ridiculous ploy to pull seniors or anybody for that matter.  not to mention they did not seem professional. never will we return.
consistent haircut every time with fast service.
"this shop is terrific!  larissa and irene are very good.  haircut is efficient, personal, and always what i want.  the haircut is so good that it is literally wash and go at home - very good styling."
"the staff was pretty unfriendly, which is always weird because you expect the person cutting your hair to converse at least a little. the haircut was quick and to the point, just not friendly."
"so normally i like this place for a quick cut for my oldest. i showed them a picture of what he wanted. something like that.  she says "" yeah i can do that but the edging up there? that's not going to happen. i can do the rest but that i cannot"". ok i understand you don't know how to do that because it's a ""barber"" thing. but to say ""that's not going to happen"". learn how to talk to customers. that's not the way it's done. you say that you cannot do that it's more detailed than you can do and maybe a barber would be best. but ""that's not going to happen"" just made me want to deck her. will not be coming back for a quick fix. i'll make the appointment at the regular and just wait it out.  that just brought the 4 star to a 2."
"check in on line, then wait again in shop. store is a hot mess and the associated was not nice. waste of time."
i checked in online and got serviced right away when i arrived.  usually when i get a haircut it takes about 45 minutes start to finish.  i was here for 20 minutes tops.  they rush through and don't take their time to get to know what you want.  i feel like there are parts of my hair that didn't even get cut.  there are plenty of other places in the area that are in the same price range and are better.
"i was a walk in on a busy saturday and was prepared to wait forever.  instead of forever, it was more like 10 minutes, which was nice.  carina did my hair and she did a really great job.  i went in there and told her that i wanted it short with an angle, and she went above and beyond making sure i looked good.  she asked me several times if i liked what she was doing and made sure that i was comfortable.  really excellent job for only $13.  i will definitely be back in the future!"
"cynthia.....my wife has been thrilled with the care and the time that cynthia spends with her. i tried telling her for years that you don't have to spend $65 to get a good cut and now she's a big fan. she cuts mine as well; although there's a lot less to cut, but spends time with mine as well"
"the good: - adult hair cuts are $15. - wait time are short, plus you can make a reservation ahead of time online. - easy to get it & plenty of parking. - clean location & friendly staff. the bad: - the skill level is not totally there. i left my most recent haircut unhappy as the hair dresser did not follow my request and completely missed strands of hair. unfortunately the good does not outweigh the bad here & ill be finding somewhere else for my next hair cut."
"not a good experience.  i checked in online and when i arrived told the woman at desk i wanted hair cut, blow dry, and style.  it seems she was annoyed i wanted "" the works"" as she told another customer why there was going to be a wait. if this is a problem then the service should not be offered.  will not be going back there."
r u serious ...$14 for kid hair (7 yrs old) cut....wow! they didn't even do a great job! the faded isn't right it goes up and down like a zig zag.
"after two calls to corporate headquarters with promises that the owner would call me to discuss, a negative review on yelp, and a complaint to the bbb, i finally received a phone call today from a manager stating that they would refund the $25.00 they charged for my daughter to get her hair washed and blown dry. they want me to come back in on wednesday to receive the refund. when i questioned why my sons were charged adult prices, they informed me that those prices reflect 10 and under. my one son is 10, and i pointed that out. the manager told me i had paid that price for him before after looking back at our records. they will not refund the money for charging him as an adult. so---the fact that they've been scamming me for a while makes it okay, i guess? they also said coupons would be sent in the mail. honestly, they can keep them. it's a shame. my family has been patronizing this place for years. there was a much better way to handle this and it started with the manager working with me the night i was upset that my daughter's haircut was $44.00 without any warning. avoid this place at all costs."
"not that it is that difficult to cut my balding hair, but for some reason i am always happy when i walk out of great clips. the stylists are always very friendly and try to make conversation with you.  they only charge 15 for a cut and certain times you can go in and get it for less.i did not make an appointment or check in online but i have never had to wait for more than five minutes.  this time was no exception.  the place always seems clean and organized.  i have to other places where they leave the hair on the floor between cuts and the stylists is always rummaging around in her draw looking for a clipper attachment or something.bottom line, quick, reasonably priced, friendly, clean, and they make me look good, what's not to like?"
"what a great place. the staff was friendly and upbeat. online check-in got me in and out really quickly. the area is great too, close to restaurants , other businesses and a grocery store. the shop was quick and convenient and great quality. i will certainly be back."
"better haircut in this area.  adrienne did my hair cut, she was good.  they charge $15 for adult hair cut."
"they do an online check in which i don't get, but, also so walk inns. they don't do color, but, do cuts and the basics. i'm not sure why i ever allowed anyone but tiffany to touch my hair, she is the absolute best stylist in the area! if you're looking for a great haircut, new style....someone who is approachable, funny, sweeeeeeet, and a great stylist see tiffany."
"horrible !!! i'm giving one star because i have got haircut from this place before also and they were good, otherwise the last experience with one of the hair stylist deserves zero star and was the worst ever. i'll just suggest them to stick with basics: be nice to people, and don't take customers at the 8th hour if you don't want to serve them. some hair stylist working at this place neither have skills nor experience with hair cutting, they r just pass timers..issued in public interest:- do not go to this place on thursday evening."
cheap decent hair cuts. been coming here for years with my son. everyone has always been friendly.
"i've been a great clips customer for 5 years at the voorhees shop; this was my third visit to the marlton crossing shop. never again!  my son flew in from l.a. on an all-night flight to attend a friend's wedding.  we took him to great clips for a trim which should have taken no more than 5 minutes. we called ahead to make sure the shop was open, then we went right over from the airport. it was about 8:20 on saturday morning when we entered the shop. the stylist was with a customer (no one else was waiting).  she asked if we checked-in online and we told her we did not. she told us that, nonetheless, we would be next and our wait would be 10-15 minutes.  although my son was very tired, we felt 10-15 minutes was reasonable, so we sat down to wait.  about 25 minutes later a man walked in, said he checked in online, and was then taken before us. how can an online check-in trump an in-person check-in?  my wife objected because we had been waiting patiently in excess of our estimated wait time; however the stylist just turned her back on us as she escorted the online customer to a chair. wonderful customer service, right?  if this is great clip's policy, then conceivably we could wait all day as people keep checking in online and we keep getting bumped. such a policy is also discriminatory toward the elderly, many of whom do not have or use a computer. it's time to say goodbye to great clips."
"worst haircut i ever got from one of the stylists here. i have got haircuts from this location earlier, and they have been good. this review just reflects the one experience that i had."
"although the staff was very friendly - i will never be going back to this place.  after cutting five inches off about half of my daughter's hair - i see the stylist combing thru the back of her head.  i walk over to ask if there is a problem and she tells me there is lice.  another stylist comes over to -confirm.  after i freak out - first about the lice and then about them leaving her hair like that - they took her in the back and did a hatchet job cutting the other half.  they tried to sell me their $42 kit to get rid of lice but we left and got it at cvs for half that amount.  after four hours of treatment and combing thru her hair piece by piece - we come to find out that it was actually just sand!  we had been at the beach earlier in the day.  in my panic - i did not mention that at the salon but i would think they should be able to tell the difference between lice and sand.  and if they bothered to shampoo the client before cutting the hair - it would not have been a problem but apparently they just wet the hair.   they did not charge me for the ""haircut"" but i wasted $20 and four hours of time - not to mention having my daughter so upset!   i also now have to get her hair cut again to fix the unevenness.  total customer service fail.  i am livid!"
"i'm not sure if new people were hired but this place has gotten a little better. got the haircut i asked for, quick and easy.a few mistakes here and there but they don't question and they're glad to fix it!if you want a inexpensive and quick haircut, go here.but don't expect it to be perfect!"
very disappointed with this place.my son always ask for this barber gene that cuts his hair multiple times in this place.we went because we knew he would be there.checked in and waited 10minutes for this specific barber since he was cutting someone's hair and then he was done.we were the only one waiting then a guy came in and was asked if he registered online and he said yes.he took him right away and we ended up telling them to cancel us because we asked specifically for gene.why did the other guy go first instead of my son?
terrible. checked in online and it said 0 wait time. got there about 5 minutes later and i was somehow 7th in the queue with a 35 minute wait time. they also took someone lower on the queue ahead of me. someone even said something and they still took him ahead of his place in the queue. the stylist i had didn't listen to me at all and cut layers into my hair despite me saying not to. and cut more off than i asked for. you get what you pay for i guess but that wasn't even worth $16. for that experience they should have paid me $16.
just got vincenzo's first hair cut at great clips in springfield!! great experience!! thank you so much to our wonderful hair dresser danielle!!
"worst experience ever! went here to get my daughter's haircut. we just moved to the area. the lady was so rude told my husband she would just cut my daughter's hair all off. my daughter is a 8 year old, who does get tangles easily. she had a few knots in her hair but nothing a little brushing would not have taken care of. this lady made my daughter cry and said some really hurtful things. my husband did not get her name unfortunately, but it happened today january 2. i would never suggest anyone go here unless you like being insulted. wish i could give zero stars. went to regis salon at springfield mall immediately afterwards, my daughter got a great cut and was treated wonderfully there."
they butchered my son. my 11 year old son has the easiest hair ever. seriously i have 3 kids and this one is a no-brainer which is why i allow my husband to take him to great clips. yes that's a loaded statement but all he needs is a buzz. seriously. we have never had a problem getting him a decent buzz cut. well.... not only did they use the wrong setting (a 1 vs a 2) but the neck line was completely crooked and they completely shaved bald his forehead line which again was crooked right across the front of his head. it is the craziest thing i ever saw. my son was in tears before he even left great clips and no one said anything (yes including my husband who paid and tipped for this atrocity.) i was heartbroken for my son when he returned. i have photos but will not post them in public. if anyone from great clips wanted to contact me i would be happy to share with you directly. i'm appalled at the horrible cut. i can't imagine the person who did this was even a licensed professional. luckily his hair grows fast and he is easy to forget. we will head to a seasoned professional stylist next time and pay more for a cut. i would think twice before entrusting your hair to anyone at a great clips especially this one in springfield.
"i've been here a few times and, overall, haven't had the best experiences. the real reason why i get my hair cut here is because it's close by - not for any specific stylist.frankly, all i've ever seen when i walk in here is semi-depressed looking people. no, not the customers, the workers. that's with the exception of only one woman which of whom i don't know the name of that is very bubbly, seems nice, and actually knows what she's doing. on top of that, they don't have any one person manning the register so people sometimes fight over who was waiting longer since no one was able to put anyone in the system for their waiting iist.i must say, though, that i've had a few stylists who have made my hair exactly how i wanted. but that shouldn't be as hard as they make it for a simple pixie cut."
if you want a nice haircut avoid this place at all costs. it seems like the common theme amongst all these reviews is they don't listen or care. i've gone to this place the last few haircuts and i can't do it anymore. they're very inconsistent. i get the same haircut every time and they always find a way to screw it up. latanya the lady that cut my hair this time finished my hair in less than two minutes just so she could chat with other coworkers. now my hair is very uneven and i'm embarrassed to go to work.
"customer service wasn't great, stylist spoke more to others then me. my hair was not  washed just sprayed with a spray bottle. my cut was ok but no offer to dry my hair. i left with my hair feeling dirtier then when i went in."
"my son went to great clips in springfield, pa, as he usually does, but this time he was very dissatisfied due to the butchering he received from the stylist.  we told him that if he was going to be butchered like that he was better off going to roy tweedy's ( which is a real butcher shop). i'm not sure if it was because he was a teenager, or for the fact that he use the coupon that was mailed to us, but either way they did a horrible job, and it costs more to fix his hair the way it should have been done in the first place. my husband called the salon upon my sons return, to see if we could resolve the situation, but of course we never received a response. no call back from any manager, or any apologies whatsoever. i would highly advise that no one go to great clips in springfield until they get their act together! as for us, we are a large family and we go there a lot, but will never step foot in that place again!"
"this is a chain, but a good place for a haircut. the people are always very friendly and talkative, and the haircuts are good, at least for easy hair like mine.they ask for your phone number, but don't worry- they won't call you, they just save any information about how to cut your hair and associate it with the number. that way, the next time you come in you don't have to explain what you want! for someone who lacks hair vocabulary, it's a big help.the only problem is that they will brush your neck with a lot of baby powder without asking you- you must let them know if you don't want that much.walking there from swarthmore is not the most pleasant, as you have to cross baltimore pike."
"needed to get my hair did- i live in the area and have stayed away from this place since you have to pay for a wash and a cut and a blow dry. but if i'm going to pay $30 somewhere else- why not!they do not offer color or other specialties- only cuts. i went friday night, 5pm and was in and out. i have had some scalp issues so sahara used tea tree shampoo and conditioner and spent some extra time working it in- it felt awesome.i wasn't expecting miracles since it's a walk-in salon but she gave be a good text-book layered hair cut. she was pleasant to talk with and didn't talk too much.nice work!"
"used to be typical now terrible. seriously twice i've gotten cuts by trainees who really are not experienced. one didn't even get how to blend/fade and i have the worlds thickest easiest hair to cut. i had to have her buzz it all off so i didn't look like a damn crooked rooster. after complaining to corporate, come to find out this is a franchise and they flat out don't care. fortunately chain chop shops are a dime a dozen.adding a point because another great clips location saw how messed up the cut was and fixed/recut for a huge discount."
they close 10 minutes after i got there and told me they're not accepting any more clients. i can get a crappy haircut anywhere but i choose you because you're close.
"i thought this great clips used to be really great. but, tonight's customer service was so horrible that i actually decided to install yelp app and give review so that folks will expect what kind of service they are getting. i would like to request the management team to start looking into their employees attitudes. not all of them are bad. some are really good actually. but, it's usually one that creates seriously disgusting customer experience. one bad experience might overshadow the past good experiences. i intend to visit this facility in coming days. i hope the management team takes my review seriously and i hope get to better quality services.p.s: tonight's haircut was so horrible that i could have done better job myself. i am never letting the same hairstylist touch my hair again."
"twice now, my husband has come here and the stylist has messed up to the point of just giving him a shaved head because there was a lack of communication or knowledge, i am not sure, on the stylist part. i then foolishly thought this place might be better for my children and my son now has uneven hair and my daughters hair just hangs with no style or shape. very disappointed, we will not be going back."
"my husband went to get a haircut yesterday, saturday, and was greeted by a pleasant and professional young african american woman. (the only reason i'm mentioning that is he forgot to get her name.)we were both so pleased with his haircut  and she now has a permanent client. we can't speak for the other stylists, but she did a great job. my husband's hair is very fine, and the way she cut it was perfect."
"i went to get a haircut on sunday, march 25th. the posted hours say that they close at 5pm. i tried to use the app so they knew i was on the way, but could not since it was within the last half hour of the store being open. i drove over and arrived at 4:42. and was promptly told they were not taking any more customers. there were no customers waiting and no customers being serviced. if i had arrived at 2 or 3 minutes before closing, i might understand. but it normally only takes about 15 minutes to cut my hair. needless to say, if i hadn't pre-paid for a card for the year, i would not be going back. i would like to know if the owner has other stores in the area where i could use the pre-paid card so i don't have to go back. i never had any problems for the 5 years i was using the store in ridley township, but apparently there is a dramatic change in professionalism when you move just 8 miles away."
decent haircut for a reasonable price. the quality of the haircut greatly depends on the stylist you get.
"was really in need of a good haircut the other day so i stopped in this great clips.  my hair was in terrible shape after having been butchered by a woman from another hair place over 6 months ago, and then being ""trimmed"" here and there by my mom and two daughters.  had a wash and cut for $16 plus a tip which wasn't bad at all.  dee did a great job, and thanks to her, i feel so much better now!"
"i went to great clips after my stylist at another salon left.  i brought two pictures to give the stylist an idea of what i wanted.  she asked me some questions, restated what she thought i wanted to make sure she understood, and gave me a fabulous cut! it's so rare to find someone that actually listens! the cut was exactly what i wanted.  it was $12, plus tip.  ive paid $60 or more at local salons and wasn't nearly as happy as i am with this cut.  this particular stylist is no longer there, but they all seem excellent.  women are constantly complimenting me on  my hair and asking me where i go.  they are shocked when i tell them."
"my boyfriend went in for a haircut today and from the second the girl started we both knew she had no idea what she was doing. she was super young and looked completely lost. the haircut was patchy and just looked all around awful. the manager i guess had to to fix it, and still didn't do much. would definitely not recommended this place."
