"i'm new to town, and when looking for a new place to get my hair cut, this great clips had the best rating in the area. i checked it out, and it's obvious why.i checked in online, so didn't have to wait very long when i arrived. that's an important step to take though, because this place is busy!i told my stylist what i was looking for and she went above and beyond. she was kind, checked in with me as we were going along to make sure that it was to my liking. she was so professional, fun, and overall great at her job.i'm really pleased with my haircut here and would strongly recommend it. i will absolutely be back. also, if you live in the area, watch your mail because i got a coupon for a $6.99 haircut. great price and great haircut!"
got a haircut here about 3 weeks ago. staff was friendly and efficient. will return when i am on this side of town
"wish i could give negative stars or even 0!this place has gone down hill in the past 6 months to year. different stylists at every visit. went in today to only have the absolute worse cut ever in my life. she never spoke, never confirmed what the ticket said, never asked me anything. i felt like a couple of times i thought my ears were going to get cut off. feel certain this was one of her first cuts and had no idea what to do. now i need to find a new place for hair cuts. do not go to this great clips ever. i will report to their hq. today the owner of the location contacted me to apologize and discuss my experience. he assured this issue with the stylist has been resolved. very nice for the owner to reach out to me. i will return."
"took my daughter there for an updo, never had been there before. tatiana did an excellent job with my daughter's hair and it stayed all night!! she made my daughter feel right at home by interacting with her throughout the process. she is such an awesome person! also reasonably priced! if you are looking for a great stylist, ask for tatiana!"
"first off, go see claudia, she's awesome! i have very tricky hair, i.e. cowlicks & wavy, she nailed it! i showed her a picture of the style i was looking to achieve she offered input and the final look sparked compliments since. great personality and talent, what more could you ask for?now besides great stylists, as the other girl working was very friendly and stylish as well, the store is well kept. smells nice, very clean, as well as the tools are well cleaned & maintained. last but certainly not least in today's economy, the price was very reasonable. i will certainly be back and if you're in the area and need a cut this should be your first stop... and ask if claudia is available lol."
"we came here because our normal place, sports clips, raised their prices.  here, they are having a back to school special for kids- $7.99 haircut.  the cut was decent, not fantastic but not horrible, but the woman was a tough nut to crack.  my little guy is a total charmer but this lady didn't want to smile or talk to him.  it was odd.  but his hair looks a bit more clean cut for preschool tomorrow."
"if your normal stylist isn't there, be prepared to get skipped. got there, checked in, waited a few mins (nobody else there, mind you) some other person walks in gets checked in and the lady calls him over. the stylist tried to explain that he was there earlier and left. he was removed from the check in log, so in theory, he lost his place in line, right?? nope, she puts him back on the list and calls him first and decides to skip me. wow, way to be fair! thanks for making me feel like a wanted customer!! bye!"
"only went to check it out because of $6 haircut coupon.  was maybe worth $0.25. don't remember her name but lady in the front was less than friendly , couldn't make any type of conversation during mediocre haircut. 2 stars because it does has reasonable prices. save your $ and get pizza next door :)"
"i am not very particular on who cuts my hair as long as they do a good job.  when you get your hair cut here the first time they record it in the computer and print out that request the next time you show up.  they always confirm that is still how i want my hair cut.  the employees have always been polite, some are more talkative than others and most importantly the haircut has always been consistently good.  the whole family goes here and none of us have ever had an issue.  there is also a military discount as long as you bring some sort of id."
tatiana did a fabulous cut and style for me!!  came in on my lunch hour using online check in and she listened to what i needed and made it happen.  added plus was that she has a great personality and i really enjoyed getting to know her.  price is very affordable too!
"tatiana is the best stylist ever. i usually just let anyone cut my hair but not anymore. 6 weeks ago she cut my hair in a cute short style and even when it grew out i was getting complements. i love great clips and i love my stylist, she is very talented and super friendly!!!!!"
meghan did such an awesome job cutting my girls hair that i came back the next night to have her cut mine! we all love our new haircuts.
"been going to this place for over a year now. i am always pleased with the service and great attitudes from the ladies. tatiana and mystery specifically, are always on top of things. they always do a great job, and are great folks as well!"
i have brought my son here since he was 3. michelle always does an amazing job and she's fast!
"i have been here two times in the last couple weeks taking my kids for haircuts. my little boy was given a stylish haircut that i am very pleased with. i figured after having a good experience and a coupon from my receipt that i'd go again for my little girl.i went in and the worker started asking a few questions about what i wanted to do for my little girls hair. i told her and she kept telling me, "" no you don't want to do that."" she kept repeating that even after i'd ask why not. she kept saying we'll give her a trim which i had already mentioned i wanted her hair cut and even. this was her first haircut. well the haircut turned out horribly. she then goes to blame it on my girl for ""moving"" well, first off, she's two and she wasn't moving that much because i had her on my lap and keeping her pretty still. she chopped her bangs so high and barely touched the part i actually wanted her to cut. i was not a fan of the stylist and i could tell it was not going to end well, she was older and seemed to not be up to date on the styles. let's just say i'll return but be more selective on who gets to cut my kids hair."
"i really like this place because it's so conveniently located.  it is probably a 5 minuted drive down the street from me.  the online check-in app is great... and really cuts the wait time in half, if not more.  i've been coming to this location for about 2 years now, and come in for a cut maybe  every 2 1/2 to 3 weeks.  they def. make you feel at home because they greet you right when you walk in the doors.  they def. know me by now and it's easy to feel comfortable.  i do have my go-to stylist.  they are all very personable and strike up pretty interesting conversations.  only a couple times i have felt a little unimpressed/unsatisfied with the work done.  on one occasion they gave me a taper, but totally forgot to do the other side!  i didn't bring it up at that moment because i did not notice it right away. thankfully i knew how to fix the situation myself with my own clippers back at home.  on one of my more recent visits, the stylist adamantly thought she knew what i should do with my hair, even though it was not what i was asking for.  i ultimately got my way and she cut it how i wanted it but it was just shocking that she kept trying to cut it her way.   with that being said, i now ask for particular stylist to cut my hair. that easily remedies those situations from happening in the future.  i'm due for a cut at the end of this week and let's see how it goes."
very choppy. layers weren't blended and they stick out i have to wear a ponytail until my hair grows out
my teen son got his haircut here. he's very picky and really liked the cut. we will definitely be back!
"horrible.  had a bad experience the first time and returned (shouldn't have) hoping it will be better.  majority of the workers are rude and are not genuine on their ""welcome to great clips"" or their thank u s.  i will definitely not be returning nor my husband."
"hadn't been there in years (since the stylist i liked left), decided to go back and try my luck with it being under new management. my hair was short but wasn't quite how i hoped for (having it cut about a 2 wks prior to this visit). the wait wasn't  long at all, i was actually #8 on the list so about 10 min later i'm in the chair. michelle listened to what i wanted, then did exactly what i hoped the outcome would be..i was so happy (finally). the other stylists there all seem friendly & i enjoyed chatting with them. the establishment is very well kept & clean & they now have an app that you can check yourself in and cut the wait time. as long as michelle will be there i'll definitely be back..thank you michelle"
"this was my first time at this particular great clips. i walked in on a tuesday afternoon around 4 , the wait was about 15 minutes.  i showed the hairdresser a picture of the haircut i wanted, she wavered back and forth on what type of clippers to use.  she did not seem confident in her estimation of the length of hair a particular clipper would cut. after she was done, the hairline was not uniformly even and i asked her to repeat the process.  when it was all done, i found out later that the back of my hair was also not cut evenly.  for $13 haircuts, i will not return to this location.  there are places closer in houston that will cut your hair for $5 and do a better job."
great place for boys haircuts! i use their app to sign in and hold my queue before heading up to the salon. really makes it efficient to take care of their hair between obligations.their hours are convenient  and promotions are a great deal. all with a great haircut by a friendly barber!
"very good salon. i can walk in here and get the perfect haircut for a reasonable price. this is a great place if you want to get your hair styled for not that much money. the stylists are helpful, and they listen. remember to check in online to avoid wait times!"
"i have the worst luck with hair stylists... in that when i find a good one, they leave the salon/move away/quit doing hair within the year. so i'm constantly on the prowl for a good stylist that isn't going to break the bank when i need a cut! i was in desperate need of a hair cut, and hadn't had the time to find a new 'permanent' stylist, so in a desperate attempt to look decent before heading back to work after having a baby, i took myself to the oak forest great clips one night for a quick cut. they do offer online check in, which also displays the current wait time for a stylist. there being no wait (and only about 5 minutes down the road), i opted to not check in online and headed straight over. there not being a wait actually meant that i had to wait for the stylists to finish the customers they had, then clean up, and then it was my turn in the chair. this was approximately 12 minutes after arriving at the shop, which was 630pm one night (30 mins before closing). i'm not sure if there are options for hair cuts, but i wasn't asked anything when checking in (wash and style, just a cut, etc) but i wanted a wash, cut, and style at the end, which isn't what i got. i got a dry cut and left with wet hair- ugh! i hate that, because i couldn't tell how the layers looked. it's stressful enough getting a hair cut by someone new, but when you can't even check the quality of the work until you get home is agonizing. the stylist was also not friendly at all, she kept talking with her coworkers the whole time i was being served. i'm not usually one to chat, but i felt like an intruder in her fun chat time circle, which made me more uncomfortable. being a nervous wreck from the experience and the new stylist, you might be wondering 'why 3 stars then?' the cut turned out to be ok, i wasn't in tears when i got home and dried it out. was it amazing, the best hair cut i've had in years? no. would i recommend coming here? again, probably not... unless you don't care much how the cut turns out and want something basic done. i may not be coming back, but i did get my hair trimmed up and looking much less crazy, and bought myself a few more months to find a permanent stylist!"
check ins mean absolutely nothing here ! i checked in thirty minutes prior and still have to wait while they let others cut in front. very unorganized and didn't even know we were here before or were here to check in.
i need to know where carla went to. she was the best hair stylist there. somebody please let me know some thing. thank you!
"i cant believe that carlita is not anymore with you guys, she was the best stylist ever and she was the only reason that i drive 10 miles to this great clips ,"
i have never gone to get a haircut and had the stylist be so rude as to skip me to get the woman behind me in line because she had requested her. i usually get my hair cut here but this is the worst service i have ever seen. the other stylist even said he is next and she said no she was waiting.i told her to take me off the list i'll get my hair cut else where.
"you can't beat this $13 haircut. my ""do"" is nothing too special, so i trust the great clips staff to trim it up just the way i want it, and even to shape my side bangs. the staff is very friendly. i've had cuts by three of them, two gals and a guy. they're down to earth and i always have a great conversation. this is my ""go-to"" to get rid of those nasty split ends."
these hair sylists have messed up my kids' hair twice! i don't know why i keep coming back.
"loud, rude employees who should be ashamed of their profanity-laden language."
my haircut is easy and can't be messed up.  they do the job based on what i ask for.
been coming here for so many years.  i'm always greeted by name and get great service. love that i'm able to check in through the app for a less wait time.
"this little strip mall location was polite to accept two of us right at closing time!  my cut was done quickly and professionally- my friend said he was pleased but that his stylist was really ""new"" and didn't seem like she was comfortable in the role yet."
"in my great clips has changed with the staff, geslle and tameka were the only people i've trusted and they left and i have fortunately found them if anyone would like to know where they are at message me."
"after coming to this location religiously for several years, it's time to search for another place to get my haircut. the last several times i have visited, the haircuts and shampoos have been sub par. additionally, there is a specific employee who will bother you continuously trying to up sell products. i say no, and she asks. ""are you sure?"" this goes on a couple of times. i finally told her she's being pushy and she replies that she's only joking. pretty tacky. same haircut person today and the photo is the back of my shirt after a shampoo. ugg. she asked if i wanted some product on my hair and i said yes, some gel. she then tries to use a gel product that's new, i tel her i use a specific brand and then she offers an even lesser priced brand. uggh. they have the brand there because i buy it from their shop and there was an open bottle at another station, but i guess she didn't want to spend the extra .15 of product. :(also, two of the stylists were speaking badly about the owner or manager. don't know if they realized i could hear them, but another reason not to return to great clips. the location has taken a noticeable turn for the worse in ambience and quality. recommend sports clips right across the street. they have much better reviews and stylists."
"this place is not the same without tomeka. i've been getting my haircut at this location for 2 years now and i've been able to trust almost the entire staff (dulce, tomeka, and kristen are great) when i drop in for random visits. they must have replaced most of the staff after tomeka's exit because i don't recognize any of the new stylists, and no offense, they aren't nearly as good. so not only are the stylists not as good but now they shove product marketing down your throat the entire visit. very sad day.  you can tell it's new management/ownership... and it's just not good."
"since tomeka left the energy in the salon has shifted, and not really for the better. a lot of gossiping across to each other (sometimes about other customers), and just overall downgrade in customer service with the newer staff. i only go for dulce now. if she's not there, i'm not getting a hair cut."
"on a normal basis i would give this place a good score, but today, only a few flipping days before christmas we made a big mistake by coming to the wrong person! my 15 year old has wonderful hair.  all he wanted was a trim. we told her that!  terrible hair cutter.  just chop chop chop away.  i guess i should have babysat her while she was chopping away. this is no trim. and then. they were like ""well don't pay"".  what?! it is not about not paying!!!!  it is about doing what the customer wants. we specifically told her that he likes it long.  to leave it over the ears...long in the back. look at these pictures. go practice on someone else.  not my son. lady needs more training before she gets paid again to cut hair.  listen to the customer.  not every man wants short hair. and then they blamed my 15 year old for not speaking up?! jerks. manager and owner need to contact me!"
"i just had an amazing hair cut experience with tameka. she was very professional and quick but showed great attention to detail. i felt that she really cared about how my haircut turned out. she mentioned that she wanted my hair to look great because she is ""putting her name on it.""this kind of accountability and pride in work is hard to find these days especially with a haircut under $20.thank you tameka and i will request you from now on."
i've been getting my haircut at great clips for a little over a year since i arrive to houston.the stylist's have always done a good job for me. i've had my hair done by other salon's in the surrounding area and this particular great clips seems to have their act together. the management and staff is receptive paying close attention to my hairstyle even if i don't know what i want to be done with it. and if i don't they provide me with good examples and deliver satisfying results.i've had my hair styled from everyone on the staff. there isn't anyone here that doesn't know what they're doing. i'm immensely pleased and as long as i'm in houston i will continue giving them my business. and the price is nice always falling under $10. can't beat that unless you're deployed. :)
"i've been to many different locations of great clips and this one remains my favorite. even though i have to drive 1/2 hour, i prefer it to the three locations near me. i've had both crystal and jess cut my hair and i'm very happy both times."
"great haircut for a great price! i am a female with long hair and could not believe it was just $13. dulce cut my hair and she did a magnificent job! i would highly recommend great clips to anyone who wants to save money and get a great, fast haircut. i was in and out in less than 20 minutes!"
"the wait time here is not good they need more help. the hair cuts are decent, if you need a quick cut and nothing special this would be a great place for just that."
"how does a chain haircut store get 5 stars?  let me drop some knowledge on you.i pulled into the parking lot and got the spot closest to the door.  when i walked in i was promptly greeted, and did not even have to sit down in the waiting area.  i was led straight to a chair.  this was at 5pm on a week day; when i believe it should be turbo busy.  upon being seated my stylist talked with me about my haircut.  it was not the usual formality, she really discussed how she was going to cut my hair, and what she was trying to achieve.  i appreciated the focus, and i did not feel like a part of an assembly line.  she cut my hair exactly like she said, and i was very pleased with the results.so i got a great haircut with no wait.  that's good.  now what made it five stars?  the price.  it was $6.99!  i haven't had a haircut that cheap since i was a kid and my mom would drop me at the navy base to get my ""regular boy haircut.""  i wonder if there was an ""irregular boy haircut?""  i will probably never know.  either way, i will be going back!"
dulce is the best by far! she always listens to what i want and delivers! always in and out. she is super sweet and i  hope she stays for a while! love my hair!
i stopped by before jumping a flight to dallas for a big sales meeting with a customer the following day. one of the worst hair cuts i've ever gotten. i told the lady to taper the back & use razor #2.5 to fade halfway up then blend it. this b**** use #1 & scalped me. look at the picture...it's uneven & looks like i'm losing hair. i was furious & refused to pay! i walked out & told her it was the worst hair cut i've ever gotten. a customer in the chair behind me looked at me & said - wow that is bad!
"what ever you do, criticizing an employee named jazelle will get you on her bad side. she does not take criticism well and i won't be going back for sure after having her cut my hair for the past couple of years."
"ahh, it's ok.it will grow up again. why?? could be my fault communicating what i wanted.very polite and cheerful girls otherwise!!"
"great experience! checked in online after getting my car washed and upon arrival, i waited less than 5 minutes.i will definitely be coming back to this location.service was great and stylists were friendly and complimentary of my haircut ;)yu"
"they lost a customer for sure. i have been going here for the 2 years i've lived in town. at first, things were ok, but then they start adding notes on my haircut. they never listened to the words i was saying, ""cut my hair short!"" all they did was follow the notes, that were wrong.i've had three of the worst haircuts back to back to back. i tried, but this is ridiculous. listen to your customer, if i say 2 on the side, don't give me a 3-4 crap fade. if i say cut it as short as your finger lengths will go, do that!i cut my own hair this morning fixing this place. don't go here. not worth it!"
"since there really isn't much to tell, this will be quite a short review. haircuts for men are almost $20 and combined with subpar customer service and performance this wouldn't be the first place i send a friend."
called at 8:52pm asking if i could get a quick hair wash and they said they'd take me if i got there before 9. i got there in time and was only $5. lucky they took me and price so reasonable.
do not allow charlotee i believe is her name ever cut your hair. i specifically said i have sensitive skin and scalp please use scissors she refused and only would use clippers. i politely asked if she did not know how to cut the style i've been getting for years at great clips is in my notes with no issues and she only responded it's the same. she severely screwed up my hair. worst hairstylist and customer service ever.
"extremely fast and high quality haircuts and very cheap. their online system makes it easy to see how long the wait is and get your name on the list from home, avoiding wasted time. they also keep your haircut preferences stored in their system making it more consistent. highly recommend getting your haircut with lydia, kim or margerita. i've had experiences with other barber shops where it was awkward to tell a stylist to make a change at the end but here they will ask you at the end and be very chill about anything that you ask to change (e.g. asking for a shorter cut)."
"my husband recently got a haircut at this location from michelle. he has been here multiple times in the past, and has always had a good experience. as soon as he got home i noticed how much care and detail she took on his haircut and style, even slightly trimming his facial hair to match his new style. great job, great effort."
"this location is awesome!!! the stylist are always attentive and genuine. ms. charlotte cuts my hair every week and she is always super sweet. she knows exactly how to cut my hair, but the best part is that she is always asking how i'm doing. i love this location."
"been going to this location for two years.  first stylist was excellent but relocated.  have used my current stylist, named charlotte, for about a  year.   she always does a good job. some stylists listen to you and then do what they want.  she always asks how you want your hair cut and cuts it that way. charlotte wants you to be satisfied with your hair cut and in addition, she has a great personality."
very fast service but terrible haircut. i asked for just the the ends of the top of my hair to he cut and se took of like an inch! awful haircuts
i've been to this location several times now and each time the haircuts get worse. it's safe to say i won't be going back because my hair couldn't take a worse haircut than my last one here.
love the online check in. i drive from katy to this location because of fredia. i only want her to cut my hair. i've been to other locations but keep coming here. the music can be a little louder than i like but not that bad.  i gave five stars for fredia but everyone else here would be a 3 and 1/2 to 4.
