"this arby's has great customer service!  the restaurant is clean.  the tables are shiny and you can tell they clean them regularly.  while we were having lunch, the manager passed by the table to greet  the customer.  definitely this a place i will recommend.  thank you for a great customer service!!!"
sucks bad the meat was bad and colored it was pink and disappointing it taste like . yeah it was that bad
"cleanest and most careful arby's i've ever been to. i've always gone through the drive thru here, but this is the first time i went inside to get a sandwich. the smokehouse brisket, of course. the restaurant was clean and modern. obviously it was renovated recently. i also noticed that, the food was prepared behind the register where there's a cutout so you can see clearly the preparers hands and process of making your sandwhiches. that is a really nice touch and also gives you confidence in what you're ordering. i appreciate that as a customer. as for the food, i mean arby's is the greatest. the smokehouse brisket is the best sandwich ever made, and i'm not just saying that. you have no idea what you're missing. tons of meat thrown into the sandwich and very well prepared. one of the best arby's i've been to so far."
the mozzarella sticks are amazing. they have the best 'fast-food' chocolate shake i've ever had.you won't regret going here.
i was the only one in the drive thru. yet i was asked to pull over so they can bring the food out to me. what? what sense does that make?! and if you get my order wrong then am i supposed to get out of my car and head inside to tell you? rather than just tell you at the window? weird experience.
"alright so this arbys location just re opened! so inviting, clean, spacious, and the foods is hot & fresh! the staff is smiling and eager to please. i brought in my coupons and was able to get everything i loved from arbys! i got the dine for two with jalapeño poppers. i love arbys and the only reason i come to this shopping center. i'm so happy they spruced up the place ! its getting super busy and i love it here. thank you for the great food!"
"i tried this location for the first time yesterday with my girlfriend. we went through the drive-thru. the service was good and the associate was nice. the food was ready quick and most importantly our order was made correctly! the food was also delicious, i ordered the smokehouse brisket sandwich and the meat was super tender and juicy. i strongly recommend this location!"
"very disappointed with the turkey bacon wrap, when you read the description in their website it seems to be freshly baked turkey, instead is sliced turkey that you purchased at the delicatessen. the sandwich is also cold, not what i expected from a freshly baked sliced turkey at arby's. i drove from coral gables all the way to sw 8th street a long way to drive to get a sandwich which it is not to arby's standard.very disappointed"
"arby's has always had a special place in my heart. i have never had a bad experience here and one time in buffalo, ny when i dropped my phone by accident in the garbage can (it was on my ""tray"") and i called hours later (don't ask why i didn't realize this for hours) they spent a great deal of time getting it out of the garbage for me. ok this is a really weird story but ever since then, it has been my favorite ""fast-food"" restaurant.i remember living in nyc and there was not one arby's location in all of manhattan so i convinced a friend to drive me like all the way to queens just to grab a late night arby's snack.now i live in brickell, and there really isn't an arby's that i would say is close but hey, arby's is worth the drive.so my friend and i decided to take a little adventure to arby's after waking up from a long night on the town. we finally arrived and mmmmmmmmmm i could smell the curly fries when i walked in.the staff was really friendly and the location was really clean. the food was great (as always) and i will definitely try to convince someone else to take another ""adventure"" to arby's reeeeeal soon."
we walked in and were immediately greeted.  they were polite and the place was clean.  i ordered the new blt.  the new brown sugar bacon is amazing but it could have had much more bacon for $6 on a sandwich.
i've never tried arby's and have to say move over booormcdonalds and bk. place is really good try the brisket sandwich wow damn good taste like authentic bbq sandwich. even the sweettea is good not to sweet like mcd. defiantly a fan now and i'll be back.
"hands-down the most underrated fast food place. i consider myself a classic arby's fan-- it's hard for me to deviate from the beef and cheddar with fries and a jamocha shake but every time i go friends have tried different things on the menu and they are always impressed. oh and the jalapeno poppers are insanely addictive too. yes, it's fast food but if it's mcdonald's or arby's, arby's wins every time."
best arby's in town.this arby's has been here forever and is still awesome like always.i ordered a roast beef sandwich with potato cakes chicken fingers and curly fries and a drink of sprite and it was delicious.
awesome food fast-i love arby's-p.s. bring back the arby q and put it on the regular menu.
this arby's has been here for a long time can use some updates in the decor. the sandwiches are always fresh and the fries are always hot and crispy. i personally like the new roasted chicken club sandwich very juicy. also if you like they have market fresh sandwiched made on honey wheat bread the roasted turkey swiss is very good. i like coming to arby's for the great deals and coupons i get in the mail. also it never packed with many people. during lunch the crowd does appear. the manager at this arby's is very friendly and when i leave the restaurant i always ring the bell.
"definitely my favorite drive thru fast food spot. i'm not a big fan of their fries, but they do have a couple of other tasty apps like jalapeño poppers and cheese sticks. as for the sandwiches, i haven't tried any that i haven't liked. the reuben is spot on, and if you want to try what made them famous then go with the beef and cheddar(love it with arby's sauce).they periodically come out with special sandwiches. i've tried a few different ones over the years and they're all great. however, i almost always go back to the reuben. it's that good!"
"the people have zero energy the ice cream machine is always broken, why even offer floats and ice cream?"
"i have loved arby's since i was a kid. i love it so much i almost choked to death once as a kid cause i was being too greedy and had too big of a bite in my mouth! lol... this location is kept nice and clean, both inside and out. i have always received fast, polite service in the drive-thru and everything is always delicious. i am a fan of their new sliders, particularly the buffalo chicken one. i am also quite fond of their chicken strips. they are of good quality for a fast food establishment, consisting of real chicken not processed chicken. the food seems of pretty good quality overall, again by fast food standards. they have a good variety of menu items, from their fresh marketplace sandwiches, to the classic roast beef, and all sorts of other meat sandwiches. the arby's sauce is seriously addicting and i use that stuff on everything- the curly fries, the roast beef sandwich, the chicken strips, etc etc! they have stepped their dessert game up over the past couple of years and i finally tried one of their cookies and it was delisiousss! it was soft, warm, and gooey. the caramel was crispy along the edges and it was really a treat. definitely a must try if you have a sweet tooth :)"
arriving to the store can't help to notice it is very new and clean looking. we entered and were promptly greeted by the cashier. after placing our order and getting our beverages the food was ready. the store has to be the cleanest arby's i've been to. i ordered the crispy chicken and it came out and fresh just as i expected. we got our son the roast beef sandwich and it came out hot and tasty. i just love the apple turnovers but there is never enough room for one. i of course forgot to get one to go and as i write this review i'm debating of driving over and picking some up.
"old plastic women rolling her eyes because my orders ""complicated"" i look american an speak english she goes to the back where the orders are made talking trash with the backline lady all spanish no one spoke proper english it was a terrible lunch i will not be coming back to this place"
"when late-night munchies kick in, it's nice to have several fast food options nearby. this arby's location is open till midnight and offers slightly healthier sandwich options than your typical fast food joint. i've never eaten inside but the drive thru is fast as can be and staff is always friendly."
this is by far the worst arby's  i've  been. i ordered a crispy  chicken sandwich  and a  chicken  slider. when i got home i see that the chicken sandwich  had no chicken inside and the slider looked like it was 3 days old. the bread was old nd literally  disgusting. an again how do you serve a chicken sandwich  without the damn chicken.its the main ingredient. this was the night shift.
"you can tell that arby's is getting all them stores remodeled, this one is so nice, clean, and neat, of course the food is amazing, i can eat the flat bread deals all day long.we usually come over here because our kiddo loves the roast beef sandwich, it has tons of meat and our son eats it like crazy."
"yesterday on the way to drop off my son in doral, we decided to stop at this arby's for a jamoca shake for the hubby but we ended up buying this sliders that were on their drive thru menu calling our names.  you can choose from ham and cheese slider, roast beef slider, jalapeño and cheese slider and corn beef slider. they were small, served warm and very tasty. the bread seemed fresh. ok, might not be the healthiest but this was an on the run and spare of the moment purchase. also, they have a happy hour special not sure from what time to what time but we paid for a jamoca shake and 3 sliders $3.80. but the regular price of the sliders is $1.29 each."
"came in for a quick lunch. had the beef and cheddar sandwich combo. i forgot how much i liked these! it was soo good! i had it with their dijon honey mustard... perfection! it's a better alternative to fast food burgers. i love their curly fries too. it's been a while since i've had arby's so i was reminded of their goodness when i ate the food. the desserts are pretty good too. i love their molten chocolate cake. it's super hot when you get it. the turnover pastries are pretty good too. they have different flavor options. they have chocolate, apple, and cherry.  the only thing i didn't like was that they didn't have a diaper changing station in the bathroom. in this day and age that's a must. especially if it's a family establishment. it's expected to actor to family needs."
"i am shocked. beyond shocked, actually. i've been going to this specific arby's for the longest time and i've never been an ""annoying customer"" or rude or anything of that nature. last night, however, i was so shocked by the horrible manners of the employee that i became that customer having to ask for the manager and everything. and for me to have to do that, there's got to be good reason behind it because i hate those kind of customers. last night, i went to this arby's location as per usual, and i decided to get down rather than go through the drive thru. i ordered a chicken bacon and swiss no lettuce no tomato and two chicken tender sandwiches. unfortunately, the guy taking my order misunderstood and thought i wanted regular chicken tenders, not chicken tender sandwiches and the chicken bacon swiss had lettuce and tomatoes. no big deal, i totally understand, i just let him know what happened and it sent it back to the kitchen letting them know to make the chicken tender sandwiches and to give me one without lettuce and tomatoes. not a big deal at all, right? wrong! apparently it's a huge deal to the blonde haired blue eyed lady behind the counter. the one who puts the food in the bags and whatnot. it's a huge deal for her because she's mumbling under her breath, rolling her eyes, and then proceeds to throw my food at me full speed like as if she was a pitcher for the yankees. insane. absolutely insane. i understand it can be a pain in the keister to have to remake something but all the attitude i got from her and all the throwing of the food really, truly shocked me. i've never experienced anything like this. i almost wanted to cry because i genuinely didn't think i had asked for too much and to be treated that way in a local establishment really just...sucks. i ended up talking to the manager and i left with no food in my hands and waiting for my refund to come back onto my card. never coming back here again..... immensely disappointed."
"the girl who took our order had a terrible attitude. like terrible. dark long hair and terrible ratchet acrylic nails. i'm writing this as i sit in the parking lot of their location. made us wait 15 minutes in the parking lot for the food. would walk away at the window as we were telling her what sauces we wanted. once the food was ready she walked up to the car and tapped on the window of the car with her nails like a crazy person. didn't even stand at the window just extended her arm as she walked away. and i asked her to wait while we made sure the order was right. and it wasn't, none of the sauces we asked for were there. no napkins. at all. and we ordered two buffalo chicken sandwiches which by the way were more sauce than chicken, that's how drenched in sauce it was. i told the girl about the sauces and she gave us a face walked back and still didn't come back with the ones we asked for. when i was telling her she waved me off and walked away. i looked for a receipt and guess what!? they didn't give us one. calling corporate tomorrow morning."
"first off, service is great! i walked in and was greeted with a happy and friendly smile. always good to have the employees happy and friendly. secondly, i ordered the turkey club. order was taken promptly and correctly. it was made quickly and was given the bronco berry sauce i asked for. lastly, the one thing i don't like is the price! it can be a little step. we paid about 25$ for two people and two combo meals. which is why i deducted one star. all and all arby's is great!"
"every time that i come here it never disappoints me. the food,service and appearance is great. fresh gyros and curly fries. cant deny that i will keep coming here everytime. the people are amazing   and bend over backwards for service. id ring that bell every time."
ended up here after a failed lunch at rock that burger. i was greeted upon entry which is a great sign of service. i went ahead and ordered my meal. was given the sauces i asked for and eat. i wish they were more arby's around miami . it was a good meal. loved the service.
"fast food that is actually fast. i always have a plain jane roast beef sandwich with arby's sauce. fries are good when they are not cooked in dirty oil. when i pull up to the window and can smell the oil, then i know that my fries are not going to be the best.oh, and i love that they have brisk green tea. staff has always been friendly."
"very good food and service, i have been to several arby's and this one is the best.  they are friendly and the new brown sugar bacon sandwiches come with a very nice amount of bacon!"
"i'm a regular cutomer, and the last time i had lunch, i asked the manager about the senior citizen discount, and he said that they don't offer any even though their website and their main office say they do and that the regionial manager would get back to me. that was 2 months ago, still haven't heard anything.how cheap is that?"
"why am i reviewing arby's? it's simple...i want everyone to try the 'shroom and swiss sandwich!!! omg...this is the best tasting fast food sandwich i have ever had. the 'shroom and swiss is served on a large tasty toasted bun! it's chock full of roast beef, swiss cheese and mushrooms! however, what makes this sandwich outstanding is the crispy french fried onions and the sauce they put on it!!! i would eat this daily if it didn't contain 520 calories and 28 grams of fat!!! lord knows it's good!!!"
"curly fries are the best!  what happened to your chicken salad with grapes arbys? boo hoo... i like the reuben sandwich, goes perfectly well with the horseradish!!! yummi!! it's warm, and tasty!  service is pretty good overall, friendly and efficient staff!"
"definitely my favorite drive thru fast food spot. i'm not a big fan of their fries, but they do have a couple of other tasty apps like jalapeño poppers and cheese sticks. as for the sandwiches, i haven't tried any that i haven't liked. the reuben is spot on, and if you want to try what made them famous then go with the beef and cheddar(love it with arby's sauce).they periodically come out with special sandwiches. i've tried a few different ones over the years and they're all great. however, i almost always go back to the reuben. it's that good!"
"the people have zero energy the ice cream machine is always broken, why even offer floats and ice cream?"
"i have loved arby's since i was a kid. i love it so much i almost choked to death once as a kid cause i was being too greedy and had too big of a bite in my mouth! lol... this location is kept nice and clean, both inside and out. i have always received fast, polite service in the drive-thru and everything is always delicious. i am a fan of their new sliders, particularly the buffalo chicken one. i am also quite fond of their chicken strips. they are of good quality for a fast food establishment, consisting of real chicken not processed chicken. the food seems of pretty good quality overall, again by fast food standards. they have a good variety of menu items, from their fresh marketplace sandwiches, to the classic roast beef, and all sorts of other meat sandwiches. the arby's sauce is seriously addicting and i use that stuff on everything- the curly fries, the roast beef sandwich, the chicken strips, etc etc! they have stepped their dessert game up over the past couple of years and i finally tried one of their cookies and it was delisiousss! it was soft, warm, and gooey. the caramel was crispy along the edges and it was really a treat. definitely a must try if you have a sweet tooth :)"
arriving to the store can't help to notice it is very new and clean looking. we entered and were promptly greeted by the cashier. after placing our order and getting our beverages the food was ready. the store has to be the cleanest arby's i've been to. i ordered the crispy chicken and it came out and fresh just as i expected. we got our son the roast beef sandwich and it came out hot and tasty. i just love the apple turnovers but there is never enough room for one. i of course forgot to get one to go and as i write this review i'm debating of driving over and picking some up.
"old plastic women rolling her eyes because my orders ""complicated"" i look american an speak english she goes to the back where the orders are made talking trash with the backline lady all spanish no one spoke proper english it was a terrible lunch i will not be coming back to this place"
"when late-night munchies kick in, it's nice to have several fast food options nearby. this arby's location is open till midnight and offers slightly healthier sandwich options than your typical fast food joint. i've never eaten inside but the drive thru is fast as can be and staff is always friendly."
this is by far the worst arby's  i've  been. i ordered a crispy  chicken sandwich  and a  chicken  slider. when i got home i see that the chicken sandwich  had no chicken inside and the slider looked like it was 3 days old. the bread was old nd literally  disgusting. an again how do you serve a chicken sandwich  without the damn chicken.its the main ingredient. this was the night shift.
"you can tell that arby's is getting all them stores remodeled, this one is so nice, clean, and neat, of course the food is amazing, i can eat the flat bread deals all day long.we usually come over here because our kiddo loves the roast beef sandwich, it has tons of meat and our son eats it like crazy."
"yesterday on the way to drop off my son in doral, we decided to stop at this arby's for a jamoca shake for the hubby but we ended up buying this sliders that were on their drive thru menu calling our names.  you can choose from ham and cheese slider, roast beef slider, jalapeño and cheese slider and corn beef slider. they were small, served warm and very tasty. the bread seemed fresh. ok, might not be the healthiest but this was an on the run and spare of the moment purchase. also, they have a happy hour special not sure from what time to what time but we paid for a jamoca shake and 3 sliders $3.80. but the regular price of the sliders is $1.29 each."
"came in for a quick lunch. had the beef and cheddar sandwich combo. i forgot how much i liked these! it was soo good! i had it with their dijon honey mustard... perfection! it's a better alternative to fast food burgers. i love their curly fries too. it's been a while since i've had arby's so i was reminded of their goodness when i ate the food. the desserts are pretty good too. i love their molten chocolate cake. it's super hot when you get it. the turnover pastries are pretty good too. they have different flavor options. they have chocolate, apple, and cherry.  the only thing i didn't like was that they didn't have a diaper changing station in the bathroom. in this day and age that's a must. especially if it's a family establishment. it's expected to actor to family needs."
"i am shocked. beyond shocked, actually. i've been going to this specific arby's for the longest time and i've never been an ""annoying customer"" or rude or anything of that nature. last night, however, i was so shocked by the horrible manners of the employee that i became that customer having to ask for the manager and everything. and for me to have to do that, there's got to be good reason behind it because i hate those kind of customers. last night, i went to this arby's location as per usual, and i decided to get down rather than go through the drive thru. i ordered a chicken bacon and swiss no lettuce no tomato and two chicken tender sandwiches. unfortunately, the guy taking my order misunderstood and thought i wanted regular chicken tenders, not chicken tender sandwiches and the chicken bacon swiss had lettuce and tomatoes. no big deal, i totally understand, i just let him know what happened and it sent it back to the kitchen letting them know to make the chicken tender sandwiches and to give me one without lettuce and tomatoes. not a big deal at all, right? wrong! apparently it's a huge deal to the blonde haired blue eyed lady behind the counter. the one who puts the food in the bags and whatnot. it's a huge deal for her because she's mumbling under her breath, rolling her eyes, and then proceeds to throw my food at me full speed like as if she was a pitcher for the yankees. insane. absolutely insane. i understand it can be a pain in the keister to have to remake something but all the attitude i got from her and all the throwing of the food really, truly shocked me. i've never experienced anything like this. i almost wanted to cry because i genuinely didn't think i had asked for too much and to be treated that way in a local establishment really just...sucks. i ended up talking to the manager and i left with no food in my hands and waiting for my refund to come back onto my card. never coming back here again..... immensely disappointed."
"the girl who took our order had a terrible attitude. like terrible. dark long hair and terrible ratchet acrylic nails. i'm writing this as i sit in the parking lot of their location. made us wait 15 minutes in the parking lot for the food. would walk away at the window as we were telling her what sauces we wanted. once the food was ready she walked up to the car and tapped on the window of the car with her nails like a crazy person. didn't even stand at the window just extended her arm as she walked away. and i asked her to wait while we made sure the order was right. and it wasn't, none of the sauces we asked for were there. no napkins. at all. and we ordered two buffalo chicken sandwiches which by the way were more sauce than chicken, that's how drenched in sauce it was. i told the girl about the sauces and she gave us a face walked back and still didn't come back with the ones we asked for. when i was telling her she waved me off and walked away. i looked for a receipt and guess what!? they didn't give us one. calling corporate tomorrow morning."
"first off, service is great! i walked in and was greeted with a happy and friendly smile. always good to have the employees happy and friendly. secondly, i ordered the turkey club. order was taken promptly and correctly. it was made quickly and was given the bronco berry sauce i asked for. lastly, the one thing i don't like is the price! it can be a little step. we paid about 25$ for two people and two combo meals. which is why i deducted one star. all and all arby's is great!"
"every time that i come here it never disappoints me. the food,service and appearance is great. fresh gyros and curly fries. cant deny that i will keep coming here everytime. the people are amazing   and bend over backwards for service. id ring that bell every time."
